title,post,subreddit,up_votes,up_vote_ratio
Was My Chemical Romance's most iconic outfits inspired by the DC superhero the Ray? We think so (and hope so),,DCcomics,0,0.43
Kryptonian origins?,I am trying to find the comics where it explains how the kryptonians were descendants of their gods. Also where superman bathes in the sun and glows yellow. If anyone could help or tell me any other superman recommendations I would love it!,DCcomics,0,0.38
[Cover] Excited to share my next cover art for CATWOMAN #66. Before you forget~ reach out to your LCS to pre-order yours! Selina is being discrete in sporty streetwear! Would her glasses help mask her identity? 👀,,DCcomics,77,0.86
"To me, the best Superman story of all time is Kingdom Come"," I remember first buying the hardcover edition which contained the whole series sometime in 1996 or 97 while I was on deployment in the Navy. Read it multiple times and it has stayed with me ever since.

And the reason why I think it's the best Superman story is because it didn't take the low hanging fruit approach, which is making Superman dark and edgy, or making him bewitched by red kryptonite or whatever.

Instead, Superman lost faith in society because society had lost faith in him. To me, this is profound. Superman's powers have always come not from the yellow sun, but by the people's faith in him that he would always do the right thing. He was the ideal we aspired to, even if we knew we never really could.

That loss of faith lead Superman to exile himself, and leave the world to its own fate. My reaction to that today is the same as it was back then: *Holy crap!*

Even back in the 90s, Superman was seen as a dinosaur with outdated morals and principals. Society wanted darker and grittier heroes who would kill bad guys on sight. They wanted more heroes like Batman and The Punisher (even though he's from Marvel).

The entire story was about how Superman and the classic members of the Justice League - including Batman! - gathered up all the new age superheroes and tried to show them what it meant to actually be a superhero. It was such an amazing story, and I don't really see writing like that today when it comes to Supes.

I have no idea what the new Superman movie will be about, but I sincerely hope at some point, someone tells a Superman story similar to that. Not just him saving the world from Zod or Darkseid, but grappling with an enemy more powerful than all of them: loss of hope.

Do something like that, and you can kindly STFU and take ALL my money.",DCcomics,24,0.75
I need help finding a comic book,"It's about the dark knight returns batman meeting both superman and batman (this batman wearing the neal adams batman suit). I remember Frank Miller's batman saying to superman ""I came here to meet you in Metropolis"" and to batman ""Who are you?"" and batman said ""I'm Batman"". That's all I can remember.",DCcomics,1,0.67
A plot idea for a Mr. Freeze Solo Movie,"Inspired by some old posts I found on this sub-reddit and the less than optimistic response to my recent post on WB producing solo character driven movies for DC villains like Mr. Freeze, I decided to come up with a short plot of what a potential Mr. Freeze solo movie could be.

Let me know what you're all think:

In the heart of Gotham City, lived Victor Fries, a brilliant scientist whose life was forever altered by the warmth of love and the cold embrace of loss.

The movie begins with a glimpse into Victor's past, a time when he was not yet known as the notorious Mr. Freeze. In those early days, he was a man of science, devoted to his research and driven by a relentless curiosity about the world around him. But amidst the sterile confines of his laboratory, there was a spark of humanity that set him apart – the love of his life, Nora.

Nora was unlike anyone Victor had ever known – a beacon of light in his otherwise solitary existence. With her gentle smile and kind heart, she thawed the icy walls Victor had built around himself, bringing warmth and joy into his life. Their romance blossomed slowly, like a delicate flower unfurling its petals in the warmth of the sun.

As the movie unfolds, we witness the tender moments shared between Victor and Nora – picnics in the park, late-night stargazing sessions, and stolen kisses in the moonlight. Their love is a force of nature, binding them together in a bond that transcends time and space.

But even the brightest flames are not immune to the chill of adversity, and tragedy soon strikes the young couple. Nora falls gravely ill, her once vibrant spirit dimmed by the specter of a deadly disease. As her condition worsens, Victor's world is plunged into darkness once more, his heart heavy with the weight of impending loss.

Determined to save the woman he loves, Victor throws himself into his work with renewed vigor, searching tirelessly for a cure to Nora's illness. Days turn into weeks, and weeks into months, but still, he refuses to give up hope. His laboratory becomes a sanctuary of sorts, a place where science and love intertwine in a desperate bid for salvation.

But fate is a cruel mistress, and despite Victor's best efforts, Nora's condition continues to deteriorate. As her life hangs in the balance, Victor is faced with an impossible choice – to accept defeat or to defy the laws of nature itself. And so, with a heavy heart and a determined spirit, he embarks on a journey that will forever alter the course of his destiny.

The romantic part of the movie is not merely a subplot but the very heart and soul of the story, illuminating the depths of Victor and Nora's love and the lengths to which they will go to protect it. Theirs is a love story for the ages, a tale of passion, sacrifice, and redemption that will linger in the hearts of audiences long after the credits roll.

If WB could greenlight films such as "" Isn't it romantic"" , "" A Hollywood Christmas"" and "" Locked down"", I see no reason why they can't give this a serious consideration.

The post that Inspired my idea: 
https://www.reddit.com/r/DCcomics/comments/xzybs6/discussion_how_could_or_should_a_mr_freeze_solo/",DCcomics,0,0.22
[other] Looking for a specific Green Lantern comic which i can't find anymore.,"When i started reading the green lantern i found myself reading a retelling of sorts of Hal Jordan. It told his origin story and how he became a lantern. Then, it was about a science guy who's head got blown out of proportions because of some alien tech, and Atrocitus (I believe, red demon like monster from the red lantern corpse who escaped) reaching earth. Sinestro (as Hal's mentor) and Hal were working together to piece it all together and fight Atrocitus.   


I remember needing to buy the next volume, lending out that specific run to friends of mine, but lost contact and forgot about it all. Now i want to get back into the green lantern and im REALLY trying to find this run but i cant for the life of me. Its not rebirth, i know it had something to do with secret files and origins i think, but its all very fuzzy.   


Hopefully some smart people on here can help me figure out what im talking about.",DCcomics,2,0.63
"[Comic Excerpt] Cool guys don't look at explosions, they blow things up and then walk away (Batman/Superman: Worlds Finest (2024) issue 26)",,DCcomics,192,1.0
Naomi No More,"Anyone else notice how Naomi just stopped existing?

It’s been over a year since she’s been sighted (Dark Crisis issue 1) despite there being like three events since

She just vanished with Bendis I guess. 

Weird considering how hard they tried to push her. From Young Justice to the full fledged Justice League in no time, and her own show. 

Now, nowhere to be seen. Usually characters dipping into the background aren’t so heavily used before they disappear without a trace. No mention whatsoever

That said, I’m sure that in a year I’ll be able to say the same about Clownhunter and Ghostmaker, but they weren’t as heavily pushed.",DCcomics,31,0.84
Who didn't really like Watchemen the movie,"Honestly i didn't enjoy to watch it because it was boring, no much sense and long.

I didn't really like as much characters as much appart the blue guy and the detective were quite all right . The rest  of people was garbage.

Basicaly Synder copied everything pretty much  on Justice League ,that is  one reason I hated it.

It is also one of this comercial film with the same silly script. Always the good guy vs the villains. That's tirering.

",DCcomics,0,0.21
[Comic Excerpt] Harley Quinn (2021-) #6 by Stephanie Phillips,,DCcomics,140,0.97
"[Comic Excerpt] ""Yuji Itadori from Jujutsu Kaisen makes a cameo in a DC Comic"" (Nightwing #113)!",https://twitter.com/screentime/status/1780304353166799238?t=W1yfUtuPJLW5GaJBR1tQXA&amp;s=19,DCcomics,265,0.97
"[artwork] super-robin by dan mora, world's finest #26",,DCcomics,76,0.99
"[Comic Excerpt] Female supersons ,Joker damian and more....(Wonder Woman #8)",,DCcomics,290,0.97
"Boom, Boom! Harley Quinn","I am a huge fan of Harley and i made a song about her, wanted to get a bit of crazy in the song and i think i did it right. Feel free to comments !

  
[https://youtu.be/xVo6n6Q1K8s](https://youtu.be/xVo6n6Q1K8s)",DCcomics,1,0.53
"If Batman's philosophy is to never kill, why does he have a way to kill all his friends?","A lot of versions of Batman have a way to kill every other member of the Justice League, when he won't even kill any of his villains. I'm not very versed in comics so I'd like to ask people who are to tell me why his philosophy allows him to have that means to kill his friends, but not the ability to kill his villains?",DCcomics,0,0.2
"[Comic Excerpt] The Wonder Girls bonding (Wonder Woman #8, 2024)",,DCcomics,471,0.95
[Cover]Injustice: Gods Among Us turns 11 years old today,,DCcomics,76,0.94
Is there a good starting point for The Creeper?,"I just watched the Batman: TAS episode ""Beware the Creeper"", and I was wondering if there was a good comics collection for the character. Did he have his own stories? Or was he always just a side character?",DCcomics,5,0.78
"[Comic Excerpt] ""You're worrying too much, RoboJon."" (Wonder Woman #8)",,DCcomics,322,0.97
"[Cover] A little reminder that this existed (Art by Scott Shaw and Carol Lay - 1986, #1, #2, #3)",,DCcomics,44,0.97
[Other] What is your gold standard for a great Batman run? (Various),,DCcomics,2,0.57
[Comic Excerpt] The Best Restaurant in Blüdhaven. Lovely Tribute to Marv Wolfman and George Pérez. [Nightwing #113],,DCcomics,315,0.98
Authority Comics Recommendations ,"So I know that the Authority is going to be in James Gunns Superman. I don’t know much about them and am intrigued. 

Do you know which version or comic books he plans on using for inspiration? I want to be prepared for when I see them on the big screen.  ",DCcomics,0,0.5
[Film/TV] Joker (2019) - GTA Train Map (Work in Progress),"
Hey all,

I was seeing the Joker (2019) BTS of how the movie was made and I saw that the crew made a map of the city. I tried to see if there was any map already made but there was a low res one only. So I tried to make a new map from using the BTS footage. It’s still a work in progress but that’s how it is supposed to look when you overlay one on the other. I’m still working on it and will be taking out the stacked sections and keeping the map only

Let me know what you think  ",DCcomics,4,0.7
Batman Who Laughs Reading Order,"Hello Everyone,  
I have been really interested in the Batman who laughs. I'm looking for the reading order for his entire comic series and where to either read it on an e-reader or buy a physical copy.  
Before I made this post, I look at several other posts talking abt the reading order but its kind of confusing. One post did tell me the reading order but they were all different issues.Then I saw there is a Dark Nights Metal Omnibus so this is kind of confusing.  
So can anyone kindly help me from where to start..  
",DCcomics,1,0.56
[Artwork] The Question and Green Arrow by @Himemina_02,,DCcomics,26,0.92
Is Joker the most dangerous villain on earth?,"Joker is so unpredictable that when I match him up against any other villain (other than Darkseid, Lobo, Doomsday and villains of that power level), I can see him losing or winning quite easily. Matching up against Flash's rogue gallery and even every criminal of Gotham, and maybe even Luthor, I can see scenarios where he kills all of them if he really wants to. I'm curious what others think about this topic",DCcomics,0,0.23
Failsafe context? ,"Wondering if Zdarksy’s “Failsafe” is a good jumping on point for the bat?  Love Zdarsky, but I haven’t read Batman in years.  Will I be totally lost?  ",DCcomics,4,0.7
[other] Does anyone know where the original art is from (Chibi Riddler),Chibi 2022 riddler? Found this on the McDonald's Happy Meal toys minigame when you scan the qr code on the box and the cutscene plays for a brief moment showing this. Does anyone know where I can find a higher resolution of the image or the origin? Thanks,DCcomics,2,0.6
What do I need to read before Poison Ivy’s Ongoing solo series?,I remember there was a plot point with catwoman and ivy when catwomans comics were coming out during infinite frontier era but didn’t read it. Should I read something before I read poison ivy?,DCcomics,9,0.91
"Scott Snyder, Absolute Comics And DC All-In, The Morning After",,DCcomics,42,0.84
[Comic Excerpt] Say Cheese!! (Jay Garrick: The Flash #6),,DCcomics,182,0.97
[Artwork] Captain Atom by Artgerm (Crossposted from r/CaptainAtom),,DCcomics,20,0.96
[Film/TV] vote for your favorite superhero cartoons,,DCcomics,0,0.4
‘Superman’ Finds Jonathan Kent in Pruitt Taylor Vince | Exclusive, ['Superman' Finds Jonathan Kent in Actor Pruitt Taylor-Vince (thewrap.com)](https://www.thewrap.com/superman-jonathan-kent-actor-kent-pruitt-taylor-vince-james-gunn/) ,DCcomics,29,0.85
[Fan Art] Vixen WIP By @Chaotical Grrrl,,DCcomics,10,0.79
[Comic Excerpt] “… I don’t think we can be friends.” (Green Lantern War Journal #8),,DCcomics,28,0.88
James Tynion IV Returns to 'Nice House on the Lake' for Sequel,,DCcomics,49,0.93
[Comic Excerpt] Huge respect for Nightwing (Nightwing 2016 issue 113),,DCcomics,50,0.9
[Artwork] Titans by @Bruno_artist,,DCcomics,49,0.89
How do ya’ll read comics,"I’ve been reading beast world and I’ve had to go from beast world to titans, to green arrow and back to titans. How am I meant to know this stuff. Can somebody help me because this is really confusing.
",DCcomics,0,0.42
[Fan Art] Nightstar by Vadarts. ,,DCcomics,34,0.9
[COMIC EXCERPT] “We need to talk.” (Superman (2023) #13),,DCcomics,48,0.93
[Comic Excerpt] Looks like Dick Grayson joined Nightwing's fan club - Nightwing(2016) #98 and #113,,DCcomics,29,0.83
[Comic Excerpt] Well done DC never would I imagine I would find my self feeling bad and empathising with the Joker here he knows he can't get better and is doomed - The Killing Joker,,DCcomics,58,0.81
Jujutsu Kaisen's Yuji Itadori just snuck into the DCU,,DCcomics,0,0.39
[Comic Excerpt] I can’t wait kid (Jay Garrick: The Flash 6 2024),,DCcomics,31,0.92
Blender Roblox Commander Steel,"&amp;#x200B;

[Commander Steel](https://preview.redd.it/6yhyzgewzyuc1.png?width=1080&amp;format=png&amp;auto=webp&amp;s=bf1924753c020d124ac3e89e83053251c071b083)",DCcomics,4,0.7
[Comic Excerpt] Kon is overprotective of his girl &lt;3 (Young Justice #29),,DCcomics,29,0.89
[Comic Excerpt] A happy family. (Jay Garrick: The Flash #6),,DCcomics,27,0.85
With the announcement of Ultimate DC what would you like to see in this new Universe [DISCUSSION],,DCcomics,457,0.96
Some q's about YJ and KonCass,"So for the past week or so, I've spent a lot of time reading old serials of pre-flashpoint YJ and new 52 Teen titans, namely because of how Cassie and Conner (even Kon) are some of my favorite legacy characters (second only to the fab5). As such I have a few questions to ask. 1) Does Cassie remember the new52? I know Tim does. 2) Does no one remember Kon-El? Even Cassie? I mean she was kinda in a relationship with him.  Basically I don't get how Kon-El just randomly disappeared after all the adventures he had and how the titans just forgot about him, ik its something about harvest. 3) this is prob a common question but do you guys think we'll ever get KonCass again? I really wanna see them again and since Dawn of DC has been reviving lost relationships (DickBabs, HalCarol), can they also get revived? They haven't announced a dawn of DC YJ series yet although it makes sense why because of the Titans being the flag front. One more thinggg, have they announced a dawn of dc supergirl series because I am so confused on her origin story and if the thing about Zor-El being cyborg superman is still canon coz Zor-El got revived pre-flashpoint too.",DCcomics,0,0.33
What are some fictional characters in dc?,Like characters that inside the universe but not really real inside their universe.,DCcomics,4,0.67
"[Comic Excerpt] Justice League vs Godzilla vs Kong #6 Artist: Tom Derenick , Who is the hero to the left of Beast Boy?",,DCcomics,61,0.95
What was that Batman/Superman comic?,"I think it is pre New 52. I don’t remember a lot. Actually just one thing. Batman does some scan to find a lot of the earth has kryptonite buried in it from meteor storms and tells Superman he’s going to help clean it up. That Superman could be stronger or more powerful.

Ring a bell?",DCcomics,3,0.71
"[Comic Excerpt] ""They're scared of him, ma'am. They're afraid."" [Batman (2011) #23]",,DCcomics,33,0.88
Hellblazer Dead in America is the best book DC is publishing right now,"
Title says it all. This book is the best thing DC is publishing right now. Each new issue is better than the last. Spurrier and Campbell are the best comics duo since Ennis and Dillon. More people need to read this because we deserve an ongoing series. 

What are your thoughts?",DCcomics,6,0.76
"Gaga Quinn, by me [Artwork]",,DCcomics,17,0.79
Birds of Prey by Ed Benes [artwork],,DCcomics,855,0.91
[DISCUSSION] What does everyone think the direction for Ra's Al Ghul is?,,DCcomics,97,0.92
[Fan Art] Batman in Alex Ross Art Style,Drawn by myself🦇,DCcomics,117,0.98
[Comic Excerpt] Welp looks like Connor was having a stroke of lucky fun with the Chicks until Tim D. ruined it by revealing they were actually robots all along. Superman/Batman comic - Issue #26,,DCcomics,380,0.98
[FAN ART] Power Girl coloured!,,DCcomics,84,0.97
Should I read Dark Crisis?,"I know its a question often repeated, but I never read the series when it came out, and been focusing on everything post-Dark Crisis. But recently with House of Brainiac referencing Earth being quarantine, tying it to the current Green Lantern series, that leads back to Dark Crisis, I feel I have to ask....

Should I or is it skippable?",DCcomics,0,0.39
[Discussion] What happened to Arsenal’s tattoos?,"Please look at my original post on r/GreenArrow but to sum it up here, Roy Harper had tattoos at one point and they disappeared and I’m just looking for answers.",DCcomics,170,0.96
[Comic excerpt] Wonder Woman #7 (2024),Shopping for Batman really THAT hard?!?……….Reminds me of that Justice League cartoon episode. This was a funny issue ,DCcomics,35,0.9
"[DISCUSSION] With the Absolute DC rumors/announcement, what’s a dream writer and artist team you wanna see tackle these characters.","Link to the original article, from bleeding cool: https://bleedingcool.com/comics/scott-snyder-ultimate-line-dc-absolute-comics-all-in/

The teams/characters I would like to see include: 

- Absolute Superman:
Written by Mark Waid
Art by Dan Mora 

- Absolute Batman:
Written by Joshua Williamson
Art by Marco Chechetto 

- Absolute Wonder Woman:
Written by Kelly Thompson
Art by Leonardo Romero 

- Absolute Flash
Written by Chip Zdarsky 
Art by Nick Dragotta 

- Absolute Green Lantern
Written by Tom King
Art by Bilquis Evely 

- Absolute Aquaman
Written by Daniel Warren Johnson
Art by Daniel Warren Johnson

- Absolute Justice League
Written by Kieron Gillian 
Art by Jorge Jiménez 
",DCcomics,57,0.91
Green lantern,"Hi guys, i want to start read about green lantern, where i should start?",DCcomics,2,0.67
Scott Snyder's Ultimate Line For DC Is To Be Called Absolute Comics,,DCcomics,492,0.92
The ric arc was actually interesting ,"It was a very fun and interesting arc

The only downside was the joker stuff was a stretch and too far but it didn't deserve the hate it got

Dick himself says he views Ric as a different person it was his story not Dicks. Y'all are just haters ",DCcomics,0,0.21
[Other] FRANK MILLER likes Superman!,,DCcomics,168,0.95
"[Comic Excerpt] DC tackles Racism (World's Finest Comics #17 - Spring 1945, Writer - Jack Schiff Art - John Daly)",,DCcomics,18,0.85
Superman &amp; Wonder Woman's Children In The Multiverse,,DCcomics,0,0.24
[DISCUSSION] which Year One books would you like to see created?,,DCcomics,123,0.96
Superhero comics question,I know its not specifically related to dc but are there any other comic companies exept DC and MARVEL?,DCcomics,0,0.33
"[Other] This is my entire collection sorted from favorite to least favorite, what would you suggest I get next?",,DCcomics,26,0.87
The Flash lore,Am I the only one who thinks The Flash and Superman's comics make no sense anymore with 8 Superman and as many The Flash? What is iconic and original when there's so many of you? The Flash's fights have become so confusing because of how powerful he is. The guy is basically a God. Am I the only one who wishes a cleanup of some speedsters and supermen?,DCcomics,0,0.33
[HELP] what to read in between Dark nights metal &amp; death metal,I just finished reading the dark nights metal omnibus and was about to start reading the death metal omnibus. Is there anything i should read before starting the death metal omnibus? ,DCcomics,0,0.33
Green Lantern x Hawkgirl: Planetary Protectors [Fan Art],,DCcomics,1,0.57
[Comic Excerpt] Superman and Wonder Woman aware of their public perception in Wonder Woman #37 (1989) by George Pérez and Mindy Newell,,DCcomics,76,0.97
My problem with Jon Kent and a fix,"While aging him up was the start erasing what made Jon interesting in the first place kills the character
I like his electric blue Superman powers and I would make that his main powers since it makes him different from Conner and Clark
Also make him look different from conner
Make him Superboy and give conner a new code name maybe valor
Brake up him and jay he a boring character how is that I feel like Jon had more chemistry with ash (the person in the lazarus planet assault on krypton anthology with Jon)
And if deafening him make him 13 his stories of losing his child and being bi can still happen without making basically a young adult
Stop letting Tom Taylor write for him",DCcomics,0,0.4
(Getting back into Comics) Looking for some community recommendations and sign posting," I have always been a very casual comic hobbyist when I was last reading at the start of Rebirth. I am looking for some recommendations from the community, I know I can get some of the answers from Google, but am looking for some human experience and feedback. So if anyone could take the time to answer/give their opinion on one or more of my questions that would be fantastic.

Current and Historical reads:

Anything Superman(Inc. family stuff)

Constantine (Reading Marks of Woe, and the best version of you)

Injustice (Read all 5 years I believe)

Preacher (Book one TPB in post)

   
 Q1: I read roughly the first quarter of nearly everything DC Rebirth, but never experienced any of the big reveals. Do you think it's worth revisiting, if so is there a recommended order and set of TPB you can recommend?

Q2: What is the current continuity?  is it linked to Rebirth at all? Is the current line of books well-perceived and worth looking into?

Q3 My Missy watched the Sandman TV show without telling me or being aware it was comic adjacent and loved it. She has never read a comic in her life, and I have not read Sandman in the past (I'm aware my current read of Hellblazer is Sandman universe) is there a current line of Sandman TPB I can buy for her to enjoy? Happy for stories told in the TV show or not.

Q4: Appreciate this is not an exact science, but further recommendations for other books/lines my partner might enjoy if she enjoyed Sandman? (seems to like the concepts of the endless and Biblical stuff)

Q5: Swamp Thing have you read it and would you recommend it? would you start from the start or jump into a newer line (if it exists) TPB recommendations and general advice / pre-reading appreciated.

Q6: What is considered a hot comic line currently, wither you agree with it or not?

Q7: I seem to prefer the Vertigo, Black label lines( from my limited experience) can you recommend any books you personally love, can be any character and I will consider it for future reads.",DCcomics,3,0.67
Jensen Ackles as Jason Todd," If any of you are supernatural fans, then your probably Jensen Ackles was the voice of Jason Todd in  *Under the Red Hood.* He was also a guest star in *The Boys* and after his performance as soldier boy, I need need NEED him to play Jason in a live action!!! Jensen is an incredible actor, but a nitty gritty backstory is his bag! Jason is such a complex character, he is incredibly similar to Dean Winchester from Supernatural, a character Jensen developed for over a decade. A father using his trauma to justify his absentee behavior, idolizes his dad until he eventually fears turning into him, they even both had to DIE before their dad could really be there for them",DCcomics,0,0.25
[Artwork] Mad Hatter by me,,DCcomics,19,0.95
