title,post,subreddit,up_votes,up_vote_ratio
[Comic Excerpt] What’s up with Cassandra Cains origin? Is she a product of rape? (Batgirl #73),,DCcomics,177,0.93
[Artwork] Batman Beyond and Wonder Woman (Dan Mora),,DCcomics,441,0.97
"Hello, I need some directions- Never read comics before","Heya, so I need some directions- I want to read some batman comics because I really like the character, but I dont particularly enjoy superhero stories, its just batman specifically that I found a really fun concept.

I'm more of a realistic-high fantasy person, because of that I know very little about the comics, I have watched popular dc movies but nothing really more than that.

This is why I wanted to ask you where one should start from my position when reading batman comics, I'm not likely to read a lot of them (hell I'd want to but I just know myself well enough to know it wouldnt happen), I'm just in the middle of Malazan and wanted to try something different, so I'd appreciate a recommendation of maybe three titles I could possibly read that could show me the best of this character.

Hope thats something reasonable to ask 😅 I know there are hundreds, probably difficult to pick  so few, I would however not mind if you recommend a specific series as a single title.",DCcomics,0,0.44
[FILM/TV] it's almost time,,DCcomics,128,0.92
Dan Jurgens’ Superman Reading Guide,"Where does one begin if they want to read Dan Jurgens? I hear this guy is the best. Anyone know of any trades or omnibuses that catalogue his work, and which ought to be prioritized over others? ",DCcomics,2,0.63
Could more members of the Justice League become injustice forms?,"Ok so basically the concept of this series of Reddit posts I’m gonna make talk about what if each of the members of the Justice League become injustice forms like Superman. Tomorrow I’m gonna post my first of these series with Batman. If you have any ideas for any of them, tell me.",DCcomics,0,0.33
[Comic Excerpt] where is this panel of tim from? (issue unknown #?),,DCcomics,13,0.76
[Comic Excerpt] What do you think of Superman killing Hank Henshaw because prisons can't hold him? (Superman v2 #82 by Dan Jurgens),,DCcomics,247,0.97
Aquaman music taste,"The title is pretty self explanatory. What music do you think Aquaman would listen to? It could be badass Aquaman or classic. Me personally, I think he’d enjoy Avenged Sevenfold and Pantera",DCcomics,0,0.36
[Artwork] The Hero of Blüdhaven by Extralifeplz_daigo ,,DCcomics,25,0.92
Question about Zdasky’s Batman run ,"Hi all — tried to post this question in r/batman but was auto-removed because my account is too new. 

So, my quick question is about the Gotham War arc — how important is it to the story or can it be skipped? 

The reason I’m asking is I picked up first two trades (Failsafe &amp; Bat-man of Gotham) + Mindbomb, Joker Year One &amp; Dark Prisons in singles. 

The trade for the Gotham War comes out closer to July and I’m not sure if I’d be better off to wait and read altogether when it comes out to make sense of the overall run; or to just skip it completely if it’s not crucial to the story (and apparently bad anyway?)",DCcomics,5,0.78
[Fan Art] Cat Beast Boy showing affection by Emma Kubert ,,DCcomics,119,0.98
Favorite design from Kingdom come?,,DCcomics,151,0.99
"
Josh Keaton's web warriors 🕸️
","https://preview.redd.it/67e4geo7o6wc1.png?width=2048&amp;format=png&amp;auto=webp&amp;s=1413ff305f6f204ef5fc87aa9bb79f6268d437d5

",DCcomics,5,0.65
[Cover] Zatanna: Bring Down The House #2 (DC Black Label) – Main cover art by Javier Rodríguez,,DCcomics,160,0.99
What Vertigo comics are part of the main DC universe?,I just want to know which go with the DC universe. I know some vertigo comics are their own separate universe but which comic series are part of the DC Universe?,DCcomics,0,0.44
[Artwork] Birds of Prey #11 cover by Leonardo Romero,,DCcomics,78,0.98
[Fan Art] The boys/The Girls by euniysu/Syn,,DCcomics,109,0.92
Why did DC end Rebirth?,I remember Rebirth restored a lot of goodwill that DC had lost during the New 52. And then they pulled the plug on Rebirth in the most darkly cynical way they could. Heroes in Crisis was when they buried Rebirth’s once and for all. Just…why? Why mess with something positive?,DCcomics,0,0.38
Batman current state,"Hey everyone.

I was out of comics for some time and I thought that it is time to come back.

I finished reading Batman around the time New 52 turned into Rebirth. And I know since then it turned into Future State.
So here is my question. What to read to catch up? I care about very little about Batfamily (apart from bigger crossovers). So I want to focus on Batman main title, Detective Comics, and bigger events (Heroes in Crisis, Doomsday clock, Death Metal?). But when to read them? I want to catch up until current state.

I found some good sites that list Batman titles in order, but where to fit bigger events and crossovers into them?

",DCcomics,1,0.67
Poison Ivy Mind Control?,"I just thought of something. Poison Ivy mind controls people through pheromones and brain chemistry, right? Well can Poison Ivy’s mind control cancel out other forms of mind control? Like, as two examples, if Gorilla Grodd telepathically takes control of someone or if Lex Luther puts some kind of control chip in somebodies brain, can Poison Ivy’s pheromones override this and give her control over the person? What about deeper forms of mind control like full on brainwashing or sleeper agent training? Can she undo or override things like that?",DCcomics,3,0.72
[Discussion] Happy Belated Birthday Michael Turner,,DCcomics,11,0.87
[Comic Excerpt] Tim might have a bad case of the Stephs (Totally a Mary Jane Watson reference) (Robin 1993 issue 54),,DCcomics,34,0.91
Yakuza Boss Two-Face [FAN ART],"The idea was from how the yakuza view themselves as a necessary evil that does as much good for the community as they do to harm it; similar to Two-Face. A dichotomy of malice and compassion.

What made me want to draw it was the idea of half of Harvey being covered in tattoos, and the burnt side of his face covered with a hanya mask.

Feel free to comment your own lore for him",DCcomics,418,0.96
Secret identity (Clark),"Snyderverse tries to be ""realistic"" but he never explained why no one there didn't recognize the bespectacled Superman in MOS and BvS.

Did they give any explanation?

I know the symbolic and poetic explanations that resonate with the hero's fantasy, but they don't resonate with this edgy Zack Snyder universe.

I used to think it was because the newspapers hadn't had access to Superman's face in MOS, but BvS cancels that out.",DCcomics,0,0.31
dark crisis omnibus??,whats the likely hood of them making a dark crisis omnibus? ik they made omnibus for all the crisis so is there a chance they will for dark crisis?,DCcomics,0,0.45
Is the New 52 canon?,"I thought the New 52 was like Marvel's Ultimate Universe, but for DC, but I keep seeing stuff from it referenced in other books and got confused. Is that what Rebirth is supposed to be? A fusion of both or?",DCcomics,2,0.53
Can the mutant gene(marvel ) and a meta gene( dc) appear in the same person ,,DCcomics,0,0.3
I was this many days old when I found out Barbara previous was Jim’s niece,"So I was reading The Black Mirror this morning and saw Barbara refer to him as her “step-brother”

At best I thought she must be his half-sister, although even with what I’d read about James Jr up to then, that didn’t make sense with who his father and mother were.

But I’ve just read that pre-52 she was actually adopted by Jim.

One comment I would give though; is that unless im missing something…he was also not her step brother during The Black Mirror ",DCcomics,54,0.86
/r/DCcomics Moderator Applications 2024,"Hey folks! r/DCcomics is growing faster than ever, and we need more moderators to help out and keep this subreddit sane.

If you're interesting in any of the following:

* moderating the fandom to keep discussions civil and free of bigotry

* reshaping rules to best serve the community
* coordinating subreddit activities and discussions
* reaching out to creators and professionals for AMAs
* building resources to help new readers discover comics
* making silly titles and jokes in the weekly discussion threads
* seeing how many weirdos keep making alts",DCcomics,7,0.89
[Discussion] One of the things I love about Geoff Johns' Green Lantern is that it has a satisfying ending that can also act as an ending for the franchise. A jump-off point like Avengers: Endgame. Are there other DC runs with a somewhat closed ending that can also be a series finale for a character?,,DCcomics,111,0.95
Batman Who Laughs,,DCcomics,3,0.64
2 New 52 Questions ,"(Bare with me, I’m new to comics) 

Id like to collect everything New 52, so far I have Batman, Batman Eternal, Nightwing, Grayson, Green Arrow, &amp; Batman &amp; Robin Eternal. 

Question 1: Does someone have a list of EVERYTHING New 52? Like from Flashpoint to Rebirth? Including how many issues, #0’s, &amp; Annuals? 

Question 2: in what order should I read everything? Like does someone have a list of the chronological order or sumthin? 

For those who’re thinking “can’t he google that?” I did. One list only gave like 10 issues &amp; another is including Injustice: Gods Among Us ",DCcomics,1,0.53
[other] Which DC character do you believe deserved more popularity but never quite gained traction?,,DCcomics,373,0.97
"[Discussion] Out of all of these, BWL and God of War Batman are the only ones who could be considered to be truly evil, the others are broken.",,DCcomics,131,0.89
[Artwork] CassKon TimSteph Double Date [Commission] by 2DSwirl,,DCcomics,399,0.93
[Discussion] What's a resolution in a story that was super built-up and believable?,"One that DOESN'T continue the comic-book-superhero trope of being out of no where?

Bad guy: ""You beat my unbeatable device! H-How???""

Protag:  ""Well, you see, it's all about the Law of Cosmic Conundrums! When the gravitational anomalies of Jupiter align with the quantum fluctuations of the time-space continuum, it creates a ripple effect that destabilizes the molecular structure of your unbeatable device! It's basic astrophysics, really. """,DCcomics,4,0.65
"[Artwork] Batgirl and Red X, by Gabriel Picolo. Question: Where do I start?","Sup, guys. Where do I start?

So, I’m kinda a Marvel fan by heart, but I’ve just gotten onto tumblr, and saw some really cool fan art and character analysis on a lot of DC characters, and it’s quite interesting…

I had never really given DC the time of day, but now I realize that that was close-mindedness. But now I wanna get into some DC comic books, particularly the Batfam, all the Robins and Batgirls and whatnot… where do I start?",DCcomics,206,0.96
Could the DCEU have been saved?,"Despite polarizing movies like MOS, BvS, Suicide Squad(2016), it had a few wins. Aquamade was the first billion dollar DCEU movie. Shazam got good critical and audience score. Made OK box office numbers. The same with the first WW movie that also made over 800 million. The Joker isn't in the DCEU, but still a DC movie that relates to DCEU and it was the first R-tated billion dollar film. But what cause the other films to flop? And where there a point in time WB could have course correct the DCEU to gains like the movies I mentioned that did well?",DCcomics,0,0.35
[Comic Excerpt] Adolf Hitler sees Midnighter before he ends it all - Midnighter Volume 1 #4,,DCcomics,199,0.99
What style of comedy would you like to see the Joker use?,"I’d personally love to see him go through a Mitch Hedberg phase. Deadpan puns and weird off beat observations. 

Maybe with a story line where he actually performs stand up at a Gotham comedy club or stadium and everyone is absolutely convinced it’s a death trap but he’s actually just trying out a routine. ",DCcomics,3,0.58
Hot take: Selina Kyle as a member of Taskforce X,"I'm talking about the period before the rebirth era; Selina could've been *""recruited""* by Waller. I think she'd have been a good addition to the team, would've had interesting banter with Harley and they could've also had ""retrieval"" mussions based on her specialty: burglary.

What are your opinions?",DCcomics,4,0.56
Greyshirt by Rick Veitch,I never any dicussion about this comic. What's it about and is it worth getting into?,DCcomics,2,0.63
"If you had to limit all DC characters and villains to ONE unique super power each, what would they be?","Many super heroes have 10+ powers (IE Superman, Martian Manhunter, Flash, Zatanna), often times with a lot of overlap (super strength being the most common). 

  
What if this wasn't the case? What if all characters only had one super ability each that they alone had?

  
For the purpose of this disscussion, we will treat characters like Batman and Lex Luthor as if they have super powers. This doesn't mean they can't be smart or cool, but their superhuman exploits will be more limited.",DCcomics,0,0.36
"[Discussion] If the Punisher ended up in Gotham, could he take out all the Rogues?","Punisher ends up in Gotham, he has two weeks to kill off Batman's Rogue Gallery, can he do it?

Batman and the Batfamily won't be after him until he kills half the Rogue Gallery ",DCcomics,1,0.52
The Flash Series: I realize why I stop watching it before and why i stop watching again now haha,So I remember when the flash series was on it's season 2 I was so into it then I stopped watching after that season. Then now 2024 I saw it again on Netflix so I decided to start watching it again from the beginning and I was enjoying it. I kinda ask myself why did I stop watching this awesome series. What made me not continue watching it. Then on the last part of Season 2 when Barry Go save her mother and change the timeline. I now realized why I discontinued watching this series. I am so annoyed on the decision making of Barry Allen since the whole season 2 Her poor decision making always leads to a greater problem. And the way he gave up his speed to zoom was so dumb like it's the only thing that can save wally my ass. And now he change the timeline I cant watch it anymore. ,DCcomics,0,0.36
[Collection] DC Omnibus Shelfie,"Over the years I set a goal to collect all DC omnibus excluding the golden age ones, their monotonic spine and cover design does not appeal to me. I snagged a lot, but felt short of my target of collecting all. I managed to fill out a 5 by 5 kallax ran out of space promptly in the process. My collection still needs 30+ books to reach my goal but still am pretty proud about it. Do send your good vibe. Thanks for looking at it. Ontario native here!!",DCcomics,188,0.97
Was the statue Zatanna used in the comics?,"So in the movie justice league dark that has batman in it. (It's been a while so forgive me if I am getting it wrong) 
Justice League Vs. Felix Faust Justice 
Zatanna used a Statue she took off it's blindfold and lost all control. But what is it called and was it in the comic's?",DCcomics,1,0.56
[Cover] Batman/Superman: World's Finest #29 (Main Cover) – by Dan Mora,,DCcomics,397,0.99
Next writer for Justice League ,After Absolute Power I think it’s safe to say we’ll get a new JL book after they. Who do we think could be potential writers for it. My money is on either Mark Waid or Phillip Kennedy Johnson?,DCcomics,0,0.5
[Artwork] Absolute Power 2024 FCBD Special Edition variant by Dan Mora,,DCcomics,130,0.99
Opinions on the story Justice League vs. Suicide Squad by various authors? ,"Since I was interested in reading the aforementioned comic since it looked like a fun fight between the two groups of characters, can anyone who has already read it kindly tell me if it is well written, average or terrible?",DCcomics,1,0.56
"Screw your favorite run, what’s your most hated run (or miniseries) on a character you really like","I’ll start off with two. 

1. Chuck Austen’s Superman man. Want a Superman run written by a guy who really DOESN’T like Superman? Not a doesn’t get or wants to change Superman for different times, I mean full on does not like him? You got Chuck’s run. Where he battles his arch enemy, Repo Man, The Kingdom Gog, and his own wife in a battle for truth, Justice, and really being angry and mean at everyone. Superman is very downright unpleasant this run, and it’s actually really funny how much of a jerk he is. How LAME his villains are, from a Doomsday who is more like Lenny from Mice and Men to the invincible unstoppable omnipotent Repo Man! This is a run I have plenty of fun laughing at, but actually reading it is a painful chore. 

2. Vendetti Flash. I like Vendetti, but man did not get how to write the Flash. Everything is just wild and seems to be just throwing stuff at the wall, a Reverse Flash who is near nothing like Eobard and nothing like Hunter, a police captain who now hates the Flash for the crime of BEING REALLY FAST, and a random Riddler arc slammed into it. Nothing works in the run, from Wally’s character arc to anything Iris did to Henry Allen suddenly breaking out of jail to kill some guy who he apparently hated. It’s far more enjoyable than Austen’s run and while not as bad, is rather just incompetent. 

Any other runs you find rather bad, or just baffling in how funnily bad it is, please send! I don’t have any bile for these runs BTW, I just find them amusing in how bad they are.",DCcomics,48,0.86
[Discussion] Thoughts on the Grim Knight?,,DCcomics,20,0.75
Crisis on infinite earths ,"This might sound a little dumb cause I feel like a lot of people understand this or whatever but it like can I just straight up read crisis on infinite earths? I’ve read a decent bit of every character in the Justice league and beyond them, I’ve mostly read Batman and green lantern, but do I have to read anything before crisis on infinite earths? I’ve heard so many people talk about crisis in infinite earths and I wanna start reading it and whatever else before and after ",DCcomics,5,0.86
Wonder Woman ,"Which Wonder Woman is canon? Earth 0 prime, 1 or 2? ",DCcomics,0,0.38
[Cosplay] The Green Lantern from India.,,DCcomics,167,0.95
A Lex Luther custom made theme,https://youtu.be/N-Xw5Kes3Jk?feature=shared,DCcomics,1,0.6
"Guys, which heroes do you think become important?","Dude, I consider Green Arrow an important character, but he could be more important due to the fact that he is an intelligent hero and loyal to heroes. Interestingly, in the comics he is a character who cares about citizens and tries to help them using his bow and acrobatics despite the wealth he has in store. His personality is brilliant along with his genius mentality",DCcomics,0,0.2
Survey for thesis,"I'm writing my thesis on the impact (Latinx) superheroes have on the place branding of their respective nations and was hoping you would be willing to complete a [survey](https://erasmusuniversity.eu.qualtrics.com/jfe/form/SV_4MEsHQSu3kr6MN8) for me. It takes roughly 3 minutes to complete and you'd be doing me a great service.   
",DCcomics,2,0.6
[Cosplay] Doctor Fate (Khalid Nassour) photo edit,,DCcomics,99,0.96
"[Artwork] Robin, Superboy and Batman, by Me",,DCcomics,34,0.91
Why do you prefer DC villains over Marvel villains ,Since this is a DC sub you guys are obviously going to prefer DC villains but I’m just curious to know why.,DCcomics,0,0.38
"Batman 1989 Continues, in a Brand New Novel",,DCcomics,12,0.94
[Fan Art] Two-face by @malenjoyer,,DCcomics,48,0.98
[Other] Would you recommend batman the vampire trilogy?,,DCcomics,13,0.88
"[Comic Excerpt] Titans (2023)#10 , Raven really could have ended Thanos's career pretty early ",,DCcomics,37,0.84
[Discussion] Just finished reading Benjamin Percy's run on Green Arrow," Been meaning to check out this run for a while now and I finally did. 

Overall, I'd say it was good, with a stretch of it (volume 4 and 5) being legit great. I think Percy gets the essence of the character, which is always essential imo. There is nothing groundbreaking in his run but its generally solid. I preferred the art when it is handled by Otto Schmidt, but the other artists did a good job too. I'll always appreciate ""fighting the bigget man"" storylines, so it was nice seeing Ollie's rebirth over the course of the run.

Unfortunately I thought the last volume was super rushed, with major pacing issues and soap opera-esque plot twists and character beats that kinda soured what came before.

I think it is definitely worth a read overall if you enjoy the character. It flirts with being great but I'd say it was ""good enough"".",DCcomics,36,0.9
Why don’t they print the date of each issue on the cover anymore?,"So full disclosure, I’m the type of person that has a pull list but doesn’t read comics monthly, mostly due to having a lovely 19 month old gremlin to take care of. But every once in a while I’ll have some downtime and do my best to catch up on all of the many months worth of comics I have stacked up. 

The problem is that if I wanted to read the comics in their release order (like all of them that came out in the same week/month), I’ve now got to look up when all of them came out because it isn’t clearly printed anywhere on the cover. Does anybody know why DC stopped doing this? Was it just to give them a more clean look? Or am I just an idiot and I’m missing where the date is printed?",DCcomics,10,0.79
DC Comics is overwhelming,"I have seen so many posts from people talking about comics and all the different spinoffs and the different crisis’ and events that have rebooted the universe. Not only is keeping up with what the new universe is called (referencing how flashpoint created “the new 52”). I’ve got 8 pages on a notepad of the mainline Batman comics ranging from the 70’s to current day in order of cannon (because that’s the only character I really care about) but even that’s overwhelming because I don’t know which ones are tied into the cannon current story line. If someone could type out a list of the all of the start and end dates to each universe (meaning the golden age, new 52 and whatever other reboots of the universe there are) and help me understand because I’m overwhelmed to the point to where I can’t even bring myself to read the comics because I can’t stop thinking about how I might be wasting my time reading non cannon comics or if I’m missing out on comics that are cannon.",DCcomics,0,0.31
[Other] here’s a design I made. I’m going to remaster it soon and I wanted thoughts on it.🍇,,DCcomics,6,0.65
"[Discussion] Should a DCU Film centering on Red Hood and his team The Outlaws exist? (DCU Team consists of a combination of both volume versions of teams: Red Hood, Arsenal, Starfire, Bizzarro, &amp; Artemis)",,DCcomics,0,0.26
"[Comic Excerpt] how often was Morrison's JLA referenced in other books when it first released? Teen Titans mentions it quite often making it feel like a big deal, so I wanted to know if this was shared among other titles as well (Teen Titans #7, 12, 18)",,DCcomics,17,0.88
[Artwork] Keaton Batman WIP by Jorge Jimenez,,DCcomics,39,0.97
Green Lantern: 4 Corpsmen (Gorillaz album art parody) [Fan Art],,DCcomics,27,0.94
[Discussion] What is the DC version of this?,"Since all the former main continuities are canon, what about DC makes you feel like this?",DCcomics,778,0.91
Batman v3 040 (Superfiends Pt 4),"In this story Wonder Woman takes Batman and swaps places with ""The Gentleman"" to fight a neverending horde of monsters, but while only hours pass in Gotham decades pass there, and Bruce and Diana get VERY close

Am I tripping balls or did Tom King copy someone else, I'm SURE that I read a similar story but with Wonder Woman and Superman, and again those two became VERY close.

Enlighten me, please.",DCcomics,2,0.75
Thoughts on Hush?,"First of all, Hush should have been Jason Todd. That being said, I think the idea of a childhood friend of Bruce turned criminal mastermind with knowledge of his secret identity is a great idea. However, I'd say after his introduction he really had not much to do, so every time he came back it was just ""Grrrr I hate Bruce Wayne and I've hired fucking Prometheus to kill him for me"".

https://preview.redd.it/wcns1o2gi1wc1.png?width=705&amp;format=png&amp;auto=webp&amp;s=83baff12f42ba77cef8e8f8b6d2072d13fd33866",DCcomics,0,0.41
What if Joker (2019) and The Batman (2022) was one movie?,"A lot of people speculated that both The Batman and Joker take place in the same universe. Unfortunately, or fortunately depending on how you look at it, they do not, with them each being separate depictions of Gotham City and its cast of characters.

Personally, I don't mind this decision. It allows for more creative expressions between each property, allowing the filmmakers of both projects to not worry about continuity between films and whatnot. I mean, if they were in the same universe, that would be Batman would fight a very old Joker, seeing as how he was already an adult in his movie, with Bruce still a child. You'd be hard pressed to make a compelling Batman vs Joker story with that premise (maybe an interesting comedy perhaps).

This post, unlike others that speculate what if both movies shared a universe, rather asks what if both movies were one. Basically, what if both the plots of Joker and The Batman were mixed together into one movie? What changes would you make to have it all make sense?",DCcomics,0,0.12
[Comic Excerpt] Damian becomes Batman of hell (Future State: Gotham #15),,DCcomics,17,0.82
