title,post,subreddit,up_votes,up_vote_ratio
My DCU (Chapter 1: Gods on Earth - Act 2),"Hey everyone! I’m back with part 2 of my DCU plan! As we shift focus from the origins of the league and the rise of the Legion of Doom, we instead look at the world post-Justice Day, with the acceptance of metahumans and the rise of people who want to do good!

Quick detail to add, imagine that in my part one post, Cyborg was in the first Justice League movie. This part mentions him having been in that movie but I forgot to include him in the act 1 layout. So just look past that and we’ll be fine!

And for those of you wondering, here is the new order for act 2:

9. Cyborg Season 1 (tv show)
10. Superman: Bizarre (film)
11. Batman: The Hush Conspiracy (film)
12. Wonder Woman: God of War (film)
13. The Flash: Gorilla War (film)
14. Teen Titans (film)
15. Batgirl Season 1 (tv show)
16. The Brave and the Bold (film)
17. Aquaman: Blood Ties (film)
18. Nightwing: Agent Grayson (film)
19. Suicide Squad: Task Force X (film)
20. Green Lantern: Red War (film)
21: Justice League: Invasion (film)
22: Shazam: Rise of the Gods (film)

Without further ado, I present to you: act 2!

Cyborg Season 1 (TV Show)

Protagonist: Cyborg
Antagonist: T. O. Morrow, Red Volcano, Red Inferno, Red Torpedo
Side Characters: Silas Stone, Red Tornado, Sarah Charles
Cameo Characters: The Flash, Professor Ivo

Overall Plot: After finally coming to terms with who he is, and assisting the Justice League in their fight against the Legion of Doom, Cyborg feels comfortable with his new title as a hero and defender of peace. But when a new cyber-criminal hacks into the S.T.A.R. Labs network and hijacks it AND Cyborg for personal gain, he questions just how lost his humanity may be in his new metallic skin. But he is not the only one questioning themselves, as when one of T. O. Morrow’s robots goes rogue, will Cyborg be able to help it find the humanity it craves?

Episode 1 Plot: Cyborg returns to S.T.A.R. Labs to tell his father what he’s done, and in the process, he helps uncover a devastating cyber attack on the network.

Episode 2 Plot: Finding himself hacked, Cyborg races to fix himself before too many of S.T.A.R. Labs’s secrets, as well as his own, are leaked to the cyber-criminal.

Episode 3 Plot: After releasing himself from the “Tomorrow Hack,” Cyborg tracks down the hacker’s signal, only to be met with a dead end... and a trio of deadly robots that are looking to finish the criminal’s job.

Episode 4 Plot: After the attack, Cyborg locates the runaway from the robot group, Red Tornado, who has become self-aware and wishes to find humanity. Meanwhile, Silas, Sarah, and Morrow try to restore the lost and corrupted data at S.T.A.R. Labs, only to be met with a virus that is building itself within their lab.

Episode 5 Plot: As Cyborg is easing Red Tornado into a life of humanity, the robot notices an act of danger and decides to follow Cyborg’s lead to become a hero. Meanwhile, back at S.T.A.R. Labs, Red Volcano has built himself up and enslaved the lab crew, demanding that they steal all of the information they can before he brings the building down on them.

Episode 6 Plot: It’s the season finale, and a race against time—literally! Revealed to be the mastermind and traitor behind the cyber attack, T. O. Morrow finishes his work to create his time machine, and he is not leaving witnesses behind. Cyborg and Red Tornado must hurry to the Labs and defeat T. O. Morrow and his robots, before it is too late for everyone!

Setting: Central City

Mid-Credits Scene: Following being defeated and betrayed by his robots, T. O. Morrow is arrested while a mysterious figure monologues about his failure. This figure is revealed to be Professor Ivo, who believes that his new “Amazo Project” can succeed where Morrow failed.


Superman: Bizarre (Film)

Protagonists: Superman
Antagonists: Lex Luthor, Bizarro
Side Characters: Lois Lane, John and Martha Kent, Jimmy Olsen, Perry White, Supergirl
Cameo Character: Superboy

Plot: After showing bravery against the Legion of Doom’s  attack on what is now known as “Justice Day,” Superman and other Metahumans have become accepted in the general public as the brave heroes they are. However, Lex Luthor is not ready to let his grudge die just yet. Behind prison walls, he activates a plan called “Project Cadmus,” and unleashes a bizarre clone on Superman. But when the clone begins to show sorrow for his actions, it causes Superman to sympathize with it, and show it that there can be humanity in its soul.

Setting: Metropolis

Mid-Credits Scene: Following the original clone’s failure, Cadmus dejects Lex Luthor from their organization and focuses on starting over on the clone process. They say that they are mixing the DNA of both Superman and Luthor this time, and this is when we get our first teasing glance at Superboy.


Batman: The Hush Conspiracy (Film)

Protagonists: Batman
Antagonists: Hush, Joker, Poison Ivy, Riddler, Killer Croc, Scarecrow
Side Characters: Alfred Pennyworth, Catwoman, Nightwing, Commissioner Gordon, Lucious Fox, Tim Drake, Barbara Gordon
Cameo Characters: Superman, Lois Lane, Batgirl, Zatanna, Bane

Plot: Following the death of Jason Todd in “Justice League: Unite”, Batman has committed to working mostly alone in Gotham, and much more brutally at that. But when a new criminal mastermind comes out from the shadows, Batman must prove himself against a gauntlet of his greatest foes if he wishes to keep his city intact. But how can he keep even himself intact after Jason’s death, especially when Hush begins targeting Bruce’s closest allies. Perhaps it is time for a new kid to don the mask of Robin...

Setting: Gotham City, Briefly Metropolis, Briefly Blüdhaven

Mid-Credits Scene: Upon Hush’s defeat, the city celebrates the victory of Batman and his new Robin, all the while a mysterious man watches the celebration from afar. This man is revealed to be Bane, who is plotting a takeover of Gotham City now that the Batman has been weakened. But he still feels the time is not right, and shall wait until Batman can be properly broken.

Post-Credits Scene: After watching Batman and the new Robin save the day once again and stop the Arkham riot, Barbara tells her father she is going out to study at the library. In truth, she climbs to the rooftops and dons her new identity as Batgirl, prepared to help Batman in his crusade against crime.


Wonder Woman: God of War (Film)

Protagonist: Wonder Woman
Antagonists: Ares, Doctor Psycho
Side Characters: Hippolyta, Donna Troy, Phillipus
Cameo Characters: Circe, Kent Nelson

Plot: After her heroic actions on Justice Day, Diana returns to Paradise Island in hopes of being allowed back in. But when she returns to her home to find it in ruins, she learns of the return of the banished god Ares, and his plot to bring the mortal and immortal realms to war. Wonder Woman now makes it her duty to stop Ares and save everyone, along with the help of a powerful girl who looks a shocking amount like her.

Settings: Paradise Island, Metropolis

Mid-Credits Scene: After Ares has fallen, an ancient evil awakens from her sleep far away. Circe is revealed to be awake and on a course for Paradise Island, to bring the gods to their knees once and for all.

Post-Credits Scene: Following his brief assistance in ensuring the world is saved, Doctor Fate senses the presence of a new threat emerging, and mentions that he will need to assemble a team to stop it.


The Flash: Gorilla War (Film)

Protagonists: The Flash, Kid Flash
Antagonist: Gorilla Grodd
Side Characters: Iris West, David Singh, Henry Allen, Rudy West, Solovar
Cameo Characters: Reverse Flash, Nightwing

Plot: About a couple months into training his nephew Wally, Barry is thrown for a ride when a nation of super-intelligent gorillas invade Central City and start an uprising. Following the gorillas, Barry learns of their leader Grodd, who has overthrown the old kind Solovar and declared war on all of humanity. Barry must now put Wally’s training on hold while the speedsters try their best to stop the uprising, before all of earth is lost to the gorillas.

Settings: Central City, Gorilla City

Mid-Credits Scene: During a nightmare, Barry begins to see a figure zooming in a yellow blur, who he remembers as the thing that killed his mom. He tries to chase it, but wakes up before he can catch it. He mentions to Iris that he feels closer to catching the figure every time, and that soon, he can find out what really happened to his mother.

Post-Credits Scene: After their battle with Grodd, Barry tells Wally that he isn’t in the best position to be training him. He decides instead to leave Wally with Nightwing, who says that he is organizing his own hero team to train teenage heroes like Wally to become the best they can be. Wally happily accepts, and we get a look at the rest of the Teen Titans team.


Teen Titans (Film)

Protagonists: Nightwing, Starfire, Cyborg, Beast Boy, Raven, Donna Troy, Kid Flash
Antagonists: H.I.V.E. (Leaders: H.I.V.E. Mistress, Damien Darhk, Adeline Kane), H.I.V.E. Five (Gizmo, Jinx, Mammoth, Psimon, Ravager [Grant Wilson])
Side Characters: (Basically none other than H.I.V.E. soldiers)
Cameo Characters: Deathstroke, Spyral

Plot: Following in the footsteps of the new, inspiring Justice League, Nightwing has decided to form his own team designed to train young heroes to be the best they can be! But after a group called the H.I.V.E. attacks with their own group of newly-trained supervillains, the Titans must prove themselves as the true heroes of the future, before any innocent lives can be thrown in danger.

Setting: San Francisco 

Mid-Credits Scene: Deathstroke is meeting with the H.I.V.E., who have told him about his son’s death. Enraged, he asks for a chance at revenge on the Titans, to which H.I.V.E. offers his son’s contract for him to take up. Deathstroke accepts.

Post-Credits Scene: Nightwing is on a rooftop back in Blüdhaven, monitoring his city, when a mysterious person approaches him from the shadows. The figure says they are a part of an organization called “Spyral,” who claim they need his help for a mission of utmost importance. They reveal they know his real name, and tell him they need his help to bring down the new mayor of Blüdhaven: Blockbuster.


Batgirl Season 1 (TV Show)

Protagonist: Batgirl (Barbara Gordon)
Antagonists: James Gordon Jr., Scarecrow, Killer Moth, the Sons of Joker
Side Characters: Batman, Commissioner Gordon, Francine Charles, Alfred Pennyworth, Huntress
Cameo Characters: Nightwing, Joker

Overall Plot: Barbara Gordon is only a couple weeks into her new career as Batgirl, and it has not been easy. Between the street thugs, masked criminals, and psychopaths of Gotham City, she hasn’t been able to catch a break. But when a familiar face from her past returns to destroy her life, Barbara must prove that she has what it takes to be Batgirl of Gotham.

Episode 1 Plot: Barbara finally has a chance to prove herself when a mercenary-for-hire calling himself “Killer Moth” puts innocents in danger to get to the Batman. But will the Dark Knight agree to Batgirl’s presence, or will he still let past failures dictate his judgement?

Episode 2 Plot: To test her on the field, Batman tasks Batgirl with scoping out an arms deal taking place at the docks. But when a new vigilante calling herself the Huntress interferes because of a personal vendetta, Batgirl’s priorities and focus begin to shift. Meanwhile, Barbara’s long-hospitalized brother, James Gordon Jr., returns to Gotham City, promising his family he has changed for the better. But can he really be trusted?

Episode 3 Plot: Batgirl’s training is put on hold as Batman demands her help in stopping the Scarecrow, who has been plotting to cripple the city since his disappearance during the Arkham riot. But when Scarecrow reveals that he might have ties to Barbara’s “newly healed” brother, she begins to question if she can really trust those closest to her.

Episode 4 Plot: As her family and trust are thrown into question, Barbara launches her own private investigation to find out just what her brother has been up to while he’s been in “mental recovery.” But she can’t do it alone, and so enlists the help of the Huntress to aid her investigation, not knowing it will lead them both into the crosshairs of danger.

Episode 5 Plot: Finding themselves trapped by a cult following the Joker’s footsteps, Batgirl and Huntress have to battle their way out of a madhouse if they want to earn their freedom. But they aren’t alone, as Nightwing has been hot on the group’s trail for Batman, and has come to help the others escape by any means necessary.

Episode 6 Plot: In the season finale, Batgirl races to find her brother before he can cause any more harm to the people around him. But when the psychopath has taken their father hostage and Barbara’s roommate hostage, Batgirl must decide what kind of hero she wants to be, and what kind she needs to be to keep her city and loved ones safe.

Setting: Gotham City

Mid-Credits Scene: After her brother has been brought to justice, Batgirl is met by the Huntress once more, who reminisces on how well they’ve worked together so far. She asks if she would like to work closely in the future, perhaps start their own team, to which Batgirl agrees, hinting at the Birds of Prey.

Post-Credits Scene: The Joker pays a visit to the makeshift labyrinth the Sons of Joker created in his honor, disrespecting the place and the cult. However, he learns about the existence of Batgirl while he is there, getting irritated that another sidekick has joined his “game” with Batman, and addressing that he needs to do something about it.


The Brave and the Bold (Film)

Protagonists: Green Arrow, Black Canary
Antagonists: Malcolm Merlyn, Lady Shiva
Side Characters: both characters’ side characters (sorry for being lazy, I’m just not up to date with the Green Arrow and Black Canary mythos and NO, I did not watch Arrow)
Cameo Characters: Ra’s Al Ghul, Cheshire, Batgirl, Huntress

Plot: Star City is a lively and generous city during the day, made better by improvements from its #1 company: Queen Industries. But by night, it becomes a gold mine for crime of all sorts, crime only the vigilantes of the city are brave enough to stand up to. Green Arrow and Black Canary have met almost a year ago, and have made names for themselves as Star City’s beacons of hope, and defenders of peace. But how much good do they really stand for? It is a question that must be asked when the League of Assassins make their mark on the city, seeking to bring down everything Oliver Queen has stood for.

Setting: Star City

Mid-Credits Scene: Ra’s Al Ghul has observed Merlyn and Shiva’s failure, and deems them unfit to be part of the League of Assassins any longer. He then turns to the shadows, where he addresses to his new “star pupil” that it is her time to shine, revealing Cheshire to be the next to attack Star City.

Post-Credits Scene: While alone in a warehouse, Black Canary calls out for the person or people who helped her navigate through the League of Assassins’ base, who hadn’t revealed their identities yet. The people reveal themselves as Batgirl and Huntress, who say they have admired Black Canary’s heroism and want to recruit her into their new team. Canary asks what it is called, to which Batgirl tells her “the Birds of Prey.”


Aquaman: Blood Ties (Film)

Protagonists: Aquaman, Aqualad (Jackson Hyde)
Antagonists: Black Manta, King Shark
Side Characters: Mira, Atlantians
Cameo Characters: Amanda Waller, Rick Flag

Plot: It has been almost three years since Justice Day, and Arthur Curry finally sees peace in his life. He is the king of Atlantis, his wife and him have had a child, and relations with the surface world may be steadily increasing. However, this peace is short-lived, as Black Manta has finally returned, looking to finally enact his revenge on Aquaman. However, things are different this time around, as Arthur is not the only one who has established a family. Manta’s estranged son, Jackson Hyde, has returned to his life, and Manta intends to use his family all he can to bring down Aquaman’s.

Setting: Atlantis

Mid-Credits Scene: Following his mindless assistance in Black Manta’s plans, King Shark was found on the surface world and arrested by the government. He is approached by Amanda Waller, who offers him his freedom to return to the sea, if he works for her. He thoughtlessly agrees, and is thus knocked unconscious and brought to Belle Reve until he can come in handy.


Nightwing: Agent Grayson (Film)

Protagonist: Nightwing
Antagonists: Blockbuster, Spyral, H.I.V.E.
Side Characters: Nightwing characters, Julia Pennyworth
Cameo Characters: Batgirl, Red X

Plot: Nightwing is no more. For the past few weeks, he has been working for the covert organization Spyral as Agent Grayson, investigating the new mayor of Blüdhaven so that he may be brought to justice. But when his search leads him right back to Spyral, and the organization they are secretly working under, Grayson questions where he has aligned himself, and if he has what it takes to clean his city of evil for good.

Setting: Blüdhaven

Mid-Credits Scene: Following Dick’s death, a public memorial is held for the vigilante at Gotham, Blüdhaven, and San Francisco. But from the shadows, a mysterious figure revealed to be Red X watches, preparing himself for action now that Nightwing is dead.


Suicide Squad: Task Force X (Film)

Protagonists: Deadshot, Harley Quinn, Captain Boomerang, King Shark, Killer Frost, Rick Flag
Antagonists: Amazo, Professor Ivo
Side Characters: Amanda Waller, ARGUS team
Cameo Characters: New Members?, Lockup (bomb fodder)

Plot: The day has come. After months of making phone calls, requesting favors, and convincing the government for backing, Amanda Waller’s “Task Force X” initiative is a go. And their first mission? Infiltrating Ivo Industries to stop Professor Ivo’s mysterious “Amazo Project.” But will this ragtag team of criminals be able to complete their mission? Or will they end up being worthy of their nickname “the Suicide Squad?”

Setting: Bell Reve, Central City

Mid-Credits Scene: Amanda Waller is speaking with a government official, who claims her task force is cruel and threatens to shut it down. Waller threatens the official with worse,  at which point he asks her how much longer the task force will remain operational. She says she predicts it could come in handy in the near future, as she opens a folder containing information on various other possible criminals to join the squad.


Green Lantern: Red War (Film)

Protagonist: Green Lantern (Hal Jordan)
Antagonists: Atrocitus, Red Lantern Corps
Side Characters: Star Sapphire, John Stewart, Green Lantern Corps, Guardians, Star Sapphire Corps, Blue Lantern Corps
Cameo Characters: Justice Leaguers, Brainiac, Black Hand

Plot: Following his bravery against the Sinestro Corps and tales of his involvement in Earth’s “Justice Day,” Hal Jordan is deemed a hero by the Green Lantern Corps, with a ceremony held in his honor. But after the dreaded Red Lantern Corps attacks, Hal finds himself at the lead of another war, this time against a dangerous foe unlike any he has encountered before. Now, teaming up with new allies and old, Hal must do what it takes to save the galaxy once again, lest it be conquered by rage.

Setting: Oa, Ysmault, Coast City, other Lantern planets

Mid-Credits Scene: Back at Oa, Hal is once again celebrated for his heroism at war, along with his partner Jon Stewart. However, the Guardians discuss in private a new, concerning matter. They say that the prophecy they have been dreading is coming true, and that they must act fast. One guardian proves their theory is true, as he shows a holographic recording of a Black Lantern ring shooting through space, and heading for Earth.

Post-Credits Scene: Hal is monitoring the galaxy with Jon when they get a high-energy reading nearby. Neither can find it, until Jon points attention to a large ship right behind him. A large ship, shaped like a skull, with purple energy emitting from it.


Justice League: Invasion (Film)

Protagonists: Superman, Batman, Wonder Woman, Flash, Green Lantern, Cyborg, Aquaman, Martian Manhunter, Supergirl, Green Arrow, Black Canary, Red Tornado
Antagonists: Brainiac, Doomsday
Side Characters: Lois Lane, the Kents, Jimmy Olsen, Robin (Tim Drake), Batgirl, Titans, others
Cameo Characters: Darkseid, Steel

Plot: Actions have consequences, and with a rise in power, there will always be those who want to take said power. Brainiac, a distant relic from the remains of Krypton, has made his way to Earth to collect the planet for his own ever-growing intelligence. It is now up to the ever-expanding Justice League to stop Brainiac and bring his quest for eternal knowledge to an end. But will the League be able to defeat such a brain? Or will Krypton’s past prove too much for its sole survivor and his team?

Setting: Metropolis, Brainiac’s Ship, briefly other cities

Mid-Credits Scene: Metropolis, in great disarray, makes a public service announcement declaring the invasion over, but also reporting the tragic death of Superman. As the news announces a public funeral for the Man of Steel, a man watching the news at home stands up and heads to his workshop. He finishes construction on his own metal suit, hammer, and gadgets, donning the gear and revealing himself as Steel, the new defender of Metropolis now that Superman is gone.

Post-Credits Scene: In his war room, Darkseid is preparing an attack on Earth, calculating counter measures for the new heroes of the planet. He is interrupted by his servant Desaad, who brings him the news that Superman is dead. Darkseid smirks as he prepares his ships, declaring that Apokalips is going to war with earth.


Shazam: Rise of the Gods (Film)

Protagonist: Shazam
Antagonist: Black Adam
Side Characters: Shazam family, Wizard Shazam
Cameo Characters: Wonder Woman, Mr. Mind

Plot: In the midst of Superman’s death, the world has been rocked and in need of a new symbol of hope. One such kid finding himself lost in this new, dark day is Billy Batson, who for a few months has secretly been the superhero Shazam, having gotten his powers from the wizard by the same name. Billy’s journey has been rough, but he has gotten a sturdy grip on his powers. That is, until the Wizard’s original champion returns, and seeks revenge on his old mentor and everything he has built. Billy must now work to save his city and the family he has come to know and love from Black Adam, proving himself as worthy of being Shazam.

Setting: Fawcett City, Rock of Eternity

Mid-Credits Scene: After his brutal battle against Black Adam, Shazam is flying through the city when he is approached by Wonder Woman. She says she admired his bravery against Black Adam, and says they could use more heroes like him in the world now. She gives him an invite to the Justice League as a part-time member, an offer Shazam happily accepts.

Post-Credits Scene: (Gonna be honest, it’s late and I’m lazy, so just picture that scene at the end of the DCEU’s Shazam with Mr. Mind, but replace Sivana with Black Adam)
",DCcomics,0,0.47
Starro the Conqueror (modern take),"So with the advent of a licensed table-top roleplaying game (TTRPG) from the ""other publisher"", I've taken it upon myself to make custom DC characters playable within it.  I've a question about Starro the Conqueror: is his modern concept still the giant alien starfish that continues to grow in size with the more beings he controls?  I saw some indications of a humanoid-looking Starro and was wondering if this is the modern-day Starro, a sort of ""avatar"" of Starro, etc.  This thread has been quick to response before and I really appreciate it!

Incidentally, is anyone familiar with the aforementioned TTRPG from the big ""M""?  And if so, are you interested in seeing any of my DC builds for it?  I've made a bunch on Demiplane and more in the works, but it helps if you have the aforementioned game and some familiarity with it, as the stat blocks are a little unconventional from previous superhero RPGs.

Thanks again in advance, and please don't hate me!!  I want to represent DC well as a valuable resource for those interested!",DCcomics,0,0.5
