title,post,subreddit,up_votes,up_vote_ratio
Report: We’re Not Going To Stop Until You Engage With Our Fucking Click Drive,,TheOnion,259,0.98
The Onion Has Used The Funds From Its Click Drive To Purchase A Jet Ski,,TheOnion,141,0.97
Please Help The Onion Meet Its Click Drive Goal Of 10 Trillion Clicks Before Midnight,,TheOnion,75,0.98
The Onion Has Used The Funds From Its Click Drive To Purchase A Jet Ski,,TheOnion,194,0.99
Report: You Could Make All This Stop For Just 25 Clicks,,TheOnion,40,1.0
CDC Recommends 6 Hours Of Clicking Per Day For Healthy Fingers,,TheOnion,47,0.98
Help Slow The Demise Of Media With The Onion’s Annual Click Drive,,TheOnion,41,0.96
The Onion’s Annual Click Drive,,TheOnion,28,0.98
Supreme Court Expands Access To Roofies,,TheOnion,407,0.99
Man Still Thinks Of Computer Virus As Cartoon Worm That Bites Through Screen,,TheOnion,92,0.99
Polite Man Offers To Walk Date To Her Final Resting Place,,TheOnion,75,0.98
Study Links High Scores On Tests Of Fortitude To Becoming Leader Of The 7 Realms Later In Life,,TheOnion,27,0.94
The Official Motto Of Every State,,TheOnion,17,0.83
God To Delete Several Million Humans Due To Inactivity,,TheOnion,307,0.98
Biden Surges In Polls After Convincing Terrified Voters He Causing Eclipse,,TheOnion,735,0.99
Really Tall Guy Blocks View Of Solar Eclipse,,TheOnion,32,0.94
Watch A Live View Of The Total Solar Eclipse,,TheOnion,22,0.92
"Yeah, Sure, Elderly Man Hitting On Granddaughter Due To Dementia",,TheOnion,101,0.97
Really Tall Guy Blocks View Of Solar Eclipse,,TheOnion,71,0.99
Watch A Live View Of The Total Solar Eclipse,,TheOnion,14,0.86
Pregnant Sex Ed Teacher Must Really Know Her Stuff,,TheOnion,409,0.99
Sotheby’s Announces Auction Of Napkin On Which Jeffrey Epstein Jotted Down Idea For Pedophilia,,TheOnion,283,0.98
Biden: ‘Israel Has An Obligation Not To Harm My Reelection Chances’,,TheOnion,2355,0.93
Terrifying Shadow Cast Across Hall As Roommate’s Hookup Lumbers Toward Bathroom,,TheOnion,106,0.99
Study Finds Majority Of Americans Could Jump Parking Meter If Bum Knee Weren’t Acting Up,,TheOnion,91,0.99
Men Explain Why They Could Outscore Caitlin Clark,,TheOnion,43,0.89
Israel Orders Strike On Chef José Andrés’ Boyhood Home,,TheOnion,343,0.96
Goldendoodle Not Good With People Who Earn Less Than 6 Figures,,TheOnion,114,0.98
Pope Francis Encourages Catholics To Ask For What They Want While God In Good Mood,,TheOnion,213,0.99
"$5 Umbrella Doing The Best It Can, All Right?",,TheOnion,52,0.97
Man Receives First Genetically Modified Pig Kidney Transplant,,TheOnion,50,0.88
Things To Never Say To An RFK Jr. Voter,,TheOnion,152,0.99
AT&amp;T’s Data Breach By The Numbers,,TheOnion,19,0.95
Existential Researchers Teach Rat To Run Forever Through Exitless Maze,,TheOnion,45,0.92
Father Unaware He Been Pushing Empty Stroller For Past 8 Blocks,,TheOnion,22,0.97
European Enjoys City Centre,,TheOnion,12,0.93
Israel Assures It Doing Everything Possible To Minimize Civilians,,TheOnion,2265,0.95
8 Tardy Passengers Stranded After Cruise Captain Refuses To Let Them Board,,TheOnion,62,0.91
Sobbing Conservationists Announce Atlantic Halibut On Their Own Now After Falling Out,,TheOnion,101,0.99
Pizza Slice Must Be Really Delicious To Be Served From Behind Bulletproof Glass,,TheOnion,60,0.96
Dad Hopes New Neighbor Likes Verbal Altercations,,TheOnion,67,0.99
What Trump Will Do On His First Day In Office,,TheOnion,24,0.85
Beta Male On Date Doesn’t Even Try To Murder Woman,,TheOnion,514,0.99
Study Finds Most Effective Food Safety Technique Just Eating It And Seeing What Happens,,TheOnion,46,0.96
"Trump Warns Of Electric Vehicles Raping, Murdering Americans",,TheOnion,203,0.99
Coca-Cola Incredibly Hurt Nation Not Going To Try New Flavor They Worked So Hard On,,TheOnion,94,0.98
Best Parts Of Trump’s $60 ‘God Bless The USA’ Bible,,TheOnion,34,0.87
Nation’s Lapsed College Friends Announce Plans To Mistakenly Text You About Splitting An 8 Ball,,TheOnion,31,0.96
Cake Left Out In Break Room With No Instructions,,TheOnion,52,0.95
Subway Admits Chicken And Bacon Ranch Melt Also Sexually Attracted To Children,,TheOnion,781,0.98
Finance Whiz Has Over $300 In Bank Account,,TheOnion,220,1.0
Losing All Of His Hair And Becoming Impotent Clear Sign From Man’s Body That He Should Stay In And Play More Video Games,,TheOnion,351,0.98
Matchmaker Casually Asks Woman If She’d Be Open To Dating Outside Her Species,,TheOnion,52,0.96
Nation Shudders At Wet Sound Of Roommate Eating Eggs,,TheOnion,51,0.96
Best Bios From Dating Apps For The Unvaccinated,,TheOnion,24,0.95
Christ Getting in Shape for Second Coming,,TheOnion,290,0.98
Kids Excitedly Shake Easter Eggs Next To Ear To Find Ones Hiding Ham,,TheOnion,111,0.98
Dad’s Been On A Parenting Kick Lately,,TheOnion,115,0.95
I Would Never Ask An Audience To Put Their Hands In The Air Were I Not Willing To Do The Same,,TheOnion,96,0.95
Trump Releases ‘God Bless The USA’ Quran,,TheOnion,439,0.99
Supreme Court Justices Can Barely Hear Oral Arguments Over Upstairs Neighbor’s Loud Music,,TheOnion,235,0.98
Every Problem Conservatives Have Blamed On DEI,,TheOnion,208,0.97
Evan Gershkovich Given Final Warning About Return-To-Office Mandate,,TheOnion,29,0.92
New Childcare Bill Would Allocate Single Microwave For Kids To Cook Their Own Dinner,,TheOnion,73,0.99
Mark Zuckerberg’s Spouse Suspicious After He Begins Referring To Her As ‘Human Wife’,,TheOnion,1403,0.99
Everything We Know About The Market Debut Of Trump’s Truth Social,,TheOnion,33,0.91
Nation’s Ex-Boyfriends Drunk As Hell,,TheOnion,28,0.92
Nickelodeon Announces Dan Schneider Has Been Chemically Castrated With Slime,,TheOnion,537,0.99
Leonardo DiCaprio Sparks Engagement Rumors As Girlfriend Flaunts New NDA,,TheOnion,98,1.0
"Authorities Arrest Depraved Anglophile After Uncovering Hard Drive With 1.5 TB Of Hardcore Rory Kinnear, David Mitchell Photos",,TheOnion,48,0.97
Abandoning Wife And Kids To Visit McDonald’s In Every Foreign Country Not As Satisfying As Man Expected,,TheOnion,97,0.98
"Taco Bell Introduces New Burrito That Will Do Its Best To Satisfy Hunger, But There Are No Guarantees In This Crazy World",,TheOnion,82,0.99
U.S. Aid To Israel By The Numbers,,TheOnion,25,0.91
Secretary Of Education Fired After Throwing Chair At Nation,,TheOnion,76,0.96
What Reddit Users Can Expect Now That The Company Is Public,,TheOnion,50,0.97
What Reddit Users Can Expect Now That The Company Is Public,,TheOnion,21,0.87
But Dog Likes Fighting For Money,,TheOnion,98,0.97
Grandmother Spends Entire Day Peeling Single Potato,,TheOnion,84,0.99
Worst Side Effects Ozempic Users Don’t Want You To Know About,,TheOnion,68,0.96
Man Not Sure What More He Must Do To Make Women He Flashes Love Him,,TheOnion,133,0.97
Lackluster New Season Of ‘Chicago Fire’ Nothing But Characters Nonchalantly Responding To False Alarms,,TheOnion,121,0.97
Kamala Harris Joins D.C. Coworking Space,,TheOnion,74,0.97
Weight Watchers Announces They Went Totally Ham On Some Nachos Last Night And That’s Okay,,TheOnion,109,0.97
What The Supreme Court Decision On Mifepristone Could Mean For Reproductive Health,,TheOnion,42,0.96
Biggest Compliments Trump Has Given To Putin,,TheOnion,50,0.95
Prince Andrew Claims Pedophilia Scandal Was Just Palace’s Attempt To Cover Up His Ongoing Battle With Cancer,,TheOnion,568,0.99
Study Finds Majority Of Americans No Longer Have Energy To Stand While Brushing Teeth,,TheOnion,576,0.99
Report Shows Uvalde Police Chief Waited 2 Years In Parking Lot Outside Office Before Resigning,,TheOnion,210,1.0
Ways Donald Trump Could Raise His $454 Million Bond,,TheOnion,114,0.95
Irresponsible Millennial Wasting Money On Coffee Instead Of Pulling Out Gun And Robbing Everyone In Store,,TheOnion,136,0.99
Nation’s Bony Women Announce They Are Shivering,,TheOnion,89,0.96
Everything We Know About Jake Paul Boxing Mike Tyson,,TheOnion,8,0.71
Trump Frantically Digging Holes Around Mar-A-Lago In Hopes Of Striking $454 Million In Oil,,TheOnion,292,0.97
‘Beetlejuice’ Sequel Praised For Using Actual Demonic Forces Over CGI,,TheOnion,606,0.99
Man Has No One In Life To Stop Him From Posting Lengthy Video Condemning New ‘Ghostbusters’,,TheOnion,299,0.97
Relatives Acting Like They’ll Be Assaulted By Deranged Clown The Instant They Set Foot In Gotham City,,TheOnion,96,0.99
Study Finds Cruel 6th-Grade Girls Able To Detect Single Drop Of Menstrual Blood On Outfit From Up To One Mile Away,,TheOnion,129,0.96
Everything We Learned From Oprah’s Weight Loss Special,,TheOnion,30,0.96
Deep Bellow Of ‘I’m Hungry!’ Rolls Out Of Teenage Son’s Animal-Bone-Filled Den,,TheOnion,49,0.92
Everyone On Division III College Basketball Team 5-Foot-9,,TheOnion,30,1.0
